[0.037s] Invoking command in '/root/working/rodep_ros2/yano_ws/build/operator': AMENT_PREFIX_PATH=/root/working/rodep_ros2/yano_ws/install/operator:/root/working/rodep_ros2/yano_ws/install/custom_interfaces:${AMENT_PREFIX_PATH} CMAKE_PREFIX_PATH=/root/working/rodep_ros2/yano_ws/install/operator:/root/working/rodep_ros2/yano_ws/install/custom_interfaces LD_LIBRARY_PATH=/root/working/rodep_ros2/yano_ws/install/custom_interfaces/lib:${LD_LIBRARY_PATH} PYTHONPATH=/root/working/rodep_ros2/yano_ws/install/custom_interfaces/local/lib/python3.10/dist-packages:${PYTHONPATH} /usr/bin/ctest -C Release -D ExperimentalTest --no-compress-output -V --force-new-ctest-process
[0.045s] UpdateCTestConfiguration  from :/root/working/rodep_ros2/yano_ws/build/operator/CTestConfiguration.ini
[0.045s] Parse Config file:/root/working/rodep_ros2/yano_ws/build/operator/CTestConfiguration.ini
[0.045s]    Site: cf33789d9224
[0.046s]    Build name: (empty)
[0.046s]  Add coverage exclude regular expressions.
[0.046s] Create new tag: 20250307-1049 - Experimental
[0.046s] UpdateCTestConfiguration  from :/root/working/rodep_ros2/yano_ws/build/operator/CTestConfiguration.ini
[0.046s] Parse Config file:/root/working/rodep_ros2/yano_ws/build/operator/CTestConfiguration.ini
[0.046s] Test project /root/working/rodep_ros2/yano_ws/build/operator
[0.046s] Constructing a list of tests
[0.047s] Done constructing a list of tests
[0.047s] Updating test list for fixtures
[0.047s] Added 0 tests to meet fixture requirements
[0.047s] Checking test dependency graph...
[0.047s] Checking test dependency graph end
[0.047s] test 1
[0.048s]     Start 1: cppcheck
[0.048s] 
[0.048s] 1: Test command: /usr/bin/python3 "-u" "/opt/ros/humble/share/ament_cmake_test/cmake/run_test.py" "/root/working/rodep_ros2/yano_ws/build/operator/test_results/operator/cppcheck.xunit.xml" "--package-name" "operator" "--output-file" "/root/working/rodep_ros2/yano_ws/build/operator/ament_cppcheck/cppcheck.txt" "--command" "/opt/ros/humble/bin/ament_cppcheck" "--xunit-file" "/root/working/rodep_ros2/yano_ws/build/operator/test_results/operator/cppcheck.xunit.xml"
[0.048s] 1: Test timeout computed to be: 300
[0.154s] 1: -- run_test.py: invoking following command in '/root/working/rodep_ros2/yano_ws/src/operator':
[0.154s] 1:  - /opt/ros/humble/bin/ament_cppcheck --xunit-file /root/working/rodep_ros2/yano_ws/build/operator/test_results/operator/cppcheck.xunit.xml
[0.252s] 1: cppcheck 2.7 has known performance issues and therefore will not be used, set the AMENT_CPPCHECK_ALLOW_SLOW_VERSIONS environment variable to override this.
[0.269s] 1: -- run_test.py: return code 0
[0.269s] 1: -- run_test.py: verify result file '/root/working/rodep_ros2/yano_ws/build/operator/test_results/operator/cppcheck.xunit.xml'
[0.287s] 1/6 Test #1: cppcheck .........................   Passed    0.24 sec
[0.288s] test 2
[0.288s]     Start 2: flake8
[0.288s] 
[0.288s] 2: Test command: /usr/bin/python3 "-u" "/opt/ros/humble/share/ament_cmake_test/cmake/run_test.py" "/root/working/rodep_ros2/yano_ws/build/operator/test_results/operator/flake8.xunit.xml" "--package-name" "operator" "--output-file" "/root/working/rodep_ros2/yano_ws/build/operator/ament_flake8/flake8.txt" "--command" "/opt/ros/humble/bin/ament_flake8" "--xunit-file" "/root/working/rodep_ros2/yano_ws/build/operator/test_results/operator/flake8.xunit.xml"
[0.288s] 2: Test timeout computed to be: 60
[0.358s] 2: -- run_test.py: invoking following command in '/root/working/rodep_ros2/yano_ws/src/operator':
[0.359s] 2:  - /opt/ros/humble/bin/ament_flake8 --xunit-file /root/working/rodep_ros2/yano_ws/build/operator/test_results/operator/flake8.xunit.xml
[0.600s] 2: def generate_launch_description():
[0.600s] 2: ^
[0.601s] 2: 	return LaunchDescription([
[0.601s] 2: ^
[0.601s] 2:         Node(
[0.601s] 2: ^
[0.601s] 2:         Node(
[0.601s] 2:         ^
[0.601s] 2:             package="joy",
[0.601s] 2: ^
[0.602s] 2:             # namespace="",
[0.602s] 2: ^
[0.602s] 2:             executable="joy_node",
[0.602s] 2: ^
[0.602s] 2:             name="pub_joy"
[0.602s] 2: ^
[0.602s] 2:         ),
[0.602s] 2: ^
[0.602s] 2: 		Node(
[0.603s] 2: ^
[0.603s] 2: 			package='operator',
[0.603s] 2: ^
[0.603s] 2: 			executable='operator_node',
[0.603s] 2: ^
[0.603s] 2: 			name='operator_node',
[0.603s] 2: ^
[0.603s] 2: 			output='screen',
[0.603s] 2: ^
[0.603s] 2: 		),
[0.604s] 2: ^
[0.604s] 2: 	])
[0.604s] 2: ^
[0.604s] 2: 6     E101 indentation contains mixed spaces and tabs
[0.604s] 2: 1     E122 continuation line missing indentation or outdented
[0.604s] 2: 1     E302 expected 2 blank lines, found 1
[0.604s] 2: 8     W191 indentation contains tabs
[0.604s] 2: 
[0.604s] 2: ./launch/operator_launch.py:4:1: E302 expected 2 blank lines, found 1
[0.605s] 2: 
[0.605s] 2: ./launch/operator_launch.py:5:1: W191 indentation contains tabs
[0.605s] 2: 
[0.605s] 2: ./launch/operator_launch.py:6:1: E101 indentation contains mixed spaces and tabs
[0.605s] 2: 
[0.605s] 2: ./launch/operator_launch.py:6:9: E122 continuation line missing indentation or outdented
[0.605s] 2: 
[0.605s] 2: ./launch/operator_launch.py:7:1: E101 indentation contains mixed spaces and tabs
[0.605s] 2: 
[0.606s] 2: ./launch/operator_launch.py:8:1: E101 indentation contains mixed spaces and tabs
[0.606s] 2: 
[0.606s] 2: ./launch/operator_launch.py:9:1: E101 indentation contains mixed spaces and tabs
[0.606s] 2: 
[0.606s] 2: ./launch/operator_launch.py:10:1: E101 indentation contains mixed spaces and tabs
[0.606s] 2: 
[0.606s] 2: ./launch/operator_launch.py:11:1: E101 indentation contains mixed spaces and tabs
[0.606s] 2: 
[0.606s] 2: ./launch/operator_launch.py:12:1: W191 indentation contains tabs
[0.607s] 2: 
[0.607s] 2: ./launch/operator_launch.py:13:1: W191 indentation contains tabs
[0.607s] 2: 
[0.607s] 2: ./launch/operator_launch.py:14:1: W191 indentation contains tabs
[0.607s] 2: 
[0.607s] 2: ./launch/operator_launch.py:15:1: W191 indentation contains tabs
[0.607s] 2: 
[0.607s] 2: ./launch/operator_launch.py:16:1: W191 indentation contains tabs
[0.607s] 2: 
[0.608s] 2: ./launch/operator_launch.py:17:1: W191 indentation contains tabs
[0.608s] 2: 
[0.608s] 2: ./launch/operator_launch.py:18:1: W191 indentation contains tabs
[0.608s] 2: 
[0.608s] 2: 
[0.608s] 2: 1 files checked
[0.608s] 2: 16 errors
[0.608s] 2: 
[0.608s] 2: 'E'-type errors: 8
[0.609s] 2: 'W'-type errors: 8
[0.609s] 2: 
[0.609s] 2: Checked files:
[0.609s] 2: 
[0.609s] 2: * ./launch/operator_launch.py
[0.626s] 2: -- run_test.py: return code 1
[0.626s] 2: -- run_test.py: verify result file '/root/working/rodep_ros2/yano_ws/build/operator/test_results/operator/flake8.xunit.xml'
[0.643s] 2/6 Test #2: flake8 ...........................***Failed    0.36 sec
[0.644s] test 3
[0.644s]     Start 3: lint_cmake
[0.644s] 
[0.644s] 3: Test command: /usr/bin/python3 "-u" "/opt/ros/humble/share/ament_cmake_test/cmake/run_test.py" "/root/working/rodep_ros2/yano_ws/build/operator/test_results/operator/lint_cmake.xunit.xml" "--package-name" "operator" "--output-file" "/root/working/rodep_ros2/yano_ws/build/operator/ament_lint_cmake/lint_cmake.txt" "--command" "/opt/ros/humble/bin/ament_lint_cmake" "--xunit-file" "/root/working/rodep_ros2/yano_ws/build/operator/test_results/operator/lint_cmake.xunit.xml"
[0.644s] 3: Test timeout computed to be: 60
[0.741s] 3: -- run_test.py: invoking following command in '/root/working/rodep_ros2/yano_ws/src/operator':
[0.741s] 3:  - /opt/ros/humble/bin/ament_lint_cmake --xunit-file /root/working/rodep_ros2/yano_ws/build/operator/test_results/operator/lint_cmake.xunit.xml
[0.864s] 3: CMakeLists.txt:23: Tab found; please use spaces [whitespace/tabs]
[0.864s] 3: CMakeLists.txt:24: Tab found; please use spaces [whitespace/tabs]
[0.864s] 3: CMakeLists.txt:24: Line ends in whitespace [whitespace/eol]
[0.864s] 3: 
[0.864s] 3: 
[0.864s] 3: 3 errors
[0.885s] 3: -- run_test.py: return code 1
[0.885s] 3: -- run_test.py: verify result file '/root/working/rodep_ros2/yano_ws/build/operator/test_results/operator/lint_cmake.xunit.xml'
[0.899s] 3/6 Test #3: lint_cmake .......................***Failed    0.26 sec
[0.899s] test 4
[0.899s]     Start 4: pep257
[0.900s] 
[0.900s] 4: Test command: /usr/bin/python3 "-u" "/opt/ros/humble/share/ament_cmake_test/cmake/run_test.py" "/root/working/rodep_ros2/yano_ws/build/operator/test_results/operator/pep257.xunit.xml" "--package-name" "operator" "--output-file" "/root/working/rodep_ros2/yano_ws/build/operator/ament_pep257/pep257.txt" "--command" "/opt/ros/humble/bin/ament_pep257" "--xunit-file" "/root/working/rodep_ros2/yano_ws/build/operator/test_results/operator/pep257.xunit.xml"
[0.900s] 4: Test timeout computed to be: 60
[1.007s] 4: -- run_test.py: invoking following command in '/root/working/rodep_ros2/yano_ws/src/operator':
[1.007s] 4:  - /opt/ros/humble/bin/ament_pep257 --xunit-file /root/working/rodep_ros2/yano_ws/build/operator/test_results/operator/pep257.xunit.xml
[1.150s] 4: checking ./launch/operator_launch.py
[1.150s] 4: No problems found
[1.170s] 4: -- run_test.py: return code 0
[1.170s] 4: -- run_test.py: verify result file '/root/working/rodep_ros2/yano_ws/build/operator/test_results/operator/pep257.xunit.xml'
[1.186s] 4/6 Test #4: pep257 ...........................   Passed    0.29 sec
[1.186s] test 5
[1.187s]     Start 5: uncrustify
[1.187s] 
[1.187s] 5: Test command: /usr/bin/python3 "-u" "/opt/ros/humble/share/ament_cmake_test/cmake/run_test.py" "/root/working/rodep_ros2/yano_ws/build/operator/test_results/operator/uncrustify.xunit.xml" "--package-name" "operator" "--output-file" "/root/working/rodep_ros2/yano_ws/build/operator/ament_uncrustify/uncrustify.txt" "--command" "/opt/ros/humble/bin/ament_uncrustify" "--xunit-file" "/root/working/rodep_ros2/yano_ws/build/operator/test_results/operator/uncrustify.xunit.xml"
[1.187s] 5: Test timeout computed to be: 60
[1.257s] 5: -- run_test.py: invoking following command in '/root/working/rodep_ros2/yano_ws/src/operator':
[1.258s] 5:  - /opt/ros/humble/bin/ament_uncrustify --xunit-file /root/working/rodep_ros2/yano_ws/build/operator/test_results/operator/uncrustify.xunit.xml
[1.369s] 5: Code style divergence in file 'src/operator.cpp':
[1.369s] 5: 
[1.370s] 5: --- src/operator.cpp
[1.370s] 5: +++ src/operator.cpp.uncrustify
[1.370s] 5: @@ -19 +19 @@
[1.370s] 5: -    enum class Mode { STOP, DRIVE };
[1.370s] 5: +  enum class Mode { STOP, DRIVE };
[1.370s] 5: @@ -21,5 +21,5 @@
[1.370s] 5: -    Operator()
[1.370s] 5: -        : Node("operator"), m1_vel(0.0f), m2_vel(0.0f), mode_(Mode::STOP)
[1.370s] 5: -    {
[1.370s] 5: -        subscription_ = this->create_subscription<sensor_msgs::msg::Joy>(
[1.370s] 5: -            "/joy", 10, std::bind(&Operator::joy_callback, this, _1));
[1.370s] 5: +  Operator()
[1.370s] 5: +  : Node("operator"), m1_vel(0.0f), m2_vel(0.0f), mode_(Mode::STOP)
[1.370s] 5: +  {
[1.371s] 5: +    subscription_ = this->create_subscription<sensor_msgs::msg::Joy>(
[1.371s] 5: +      "/joy", 10, std::bind(&Operator::joy_callback, this, _1));
[1.371s] 5: @@ -27,4 +27,31 @@
[1.371s] 5: -        publisher_ = this->create_publisher<custom_interfaces::msg::DriverVelocity>("/driver", 10);
[1.371s] 5: -        
[1.371s] 5: -        service_ = this->create_service<custom_interfaces::srv::SetMode>(
[1.371s] 5: -            "/set_mode", std::bind(&Operator::set_mode_callback, this, _1, _2));
[1.371s] 5: +    publisher_ = this->create_publisher<custom_interfaces::msg::DriverVelocity>("/driver", 10);
[1.371s] 5: +
[1.371s] 5: +    service_ = this->create_service<custom_interfaces::srv::SetMode>(
[1.371s] 5: +      "/set_mode", std::bind(&Operator::set_mode_callback, this, _1, _2));
[1.371s] 5: +  }
[1.372s] 5: +
[1.372s] 5: +private:
[1.372s] 5: +  static constexpr float WIDTH = 0.29f;
[1.372s] 5: +  static constexpr float MAX_SPEED = 0.5f;
[1.372s] 5: +  static constexpr float DEADZONE = 0.1f;
[1.372s] 5: +
[1.372s] 5: +  float m1_vel, m2_vel;
[1.373s] 5: +  Mode mode_;
[1.373s] 5: +
[1.373s] 5: +  static float applyDeadzone(float val, float threshold)
[1.373s] 5: +  {
[1.373s] 5: +    return (std::abs(val) < threshold) ? 0.0f : val;
[1.373s] 5: +  }
[1.373s] 5: +
[1.374s] 5: +  void joy_callback(const sensor_msgs::msg::Joy & msg)
[1.374s] 5: +  {
[1.374s] 5: +    // ボタンをチェックしてモードを切り替える
[1.374s] 5: +    if (msg.buttons.size() > 0) {
[1.374s] 5: +      // テスト
[1.374s] 5: +      if (msg.buttons[4] == 1) {      // ボタン0が押された場合
[1.374s] 5: +        mode_ = Mode::STOP;
[1.374s] 5: +        RCLCPP_INFO(this->get_logger(), "Mode switched to STOP");
[1.375s] 5: +      } else if (msg.buttons[6] == 1) {    // ボタン1が押された場合
[1.375s] 5: +        mode_ = Mode::DRIVE;
[1.375s] 5: +        RCLCPP_INFO(this->get_logger(), "Mode switched to DRIVE");
[1.375s] 5: +      }
[1.375s] 5: @@ -33,4 +60,9 @@
[1.375s] 5: -private:
[1.375s] 5: -    static constexpr float WIDTH = 0.29f;
[1.375s] 5: -    static constexpr float MAX_SPEED = 0.5f;
[1.376s] 5: -    static constexpr float DEADZONE = 0.1f;
[1.376s] 5: +    // モードがSTOPの場合は速度を0に設定
[1.376s] 5: +    if (mode_ == Mode::STOP) {
[1.376s] 5: +      m1_vel = 0.0f;
[1.376s] 5: +      m2_vel = 0.0f;
[1.376s] 5: +    } else if (mode_ == Mode::DRIVE) {
[1.376s] 5: +      if (msg.axes.size() < 4) {
[1.376s] 5: +        RCLCPP_WARN(this->get_logger(), "Joystick axes array is too small!");
[1.377s] 5: +        return;
[1.377s] 5: +      }
[1.377s] 5: @@ -38,2 +70,2 @@
[1.377s] 5: -    float m1_vel, m2_vel;
[1.377s] 5: -    Mode mode_;
[1.377s] 5: +      float m1_axis_y = applyDeadzone(std::clamp<float>(msg.axes[1], -0.95f, 0.95f), DEADZONE);
[1.377s] 5: +      float m2_axis_y = applyDeadzone(std::clamp<float>(msg.axes[3], -0.95f, 0.95f), DEADZONE);
[1.377s] 5: @@ -41,3 +73,2 @@
[1.377s] 5: -    static float applyDeadzone(float val, float threshold)
[1.377s] 5: -    {
[1.377s] 5: -        return (std::abs(val) < threshold) ? 0.0f : val;
[1.377s] 5: +      m1_vel = std::clamp<float>(m1_axis_y * MAX_SPEED, -MAX_SPEED, MAX_SPEED);
[1.378s] 5: +      m2_vel = std::clamp<float>(m2_axis_y * MAX_SPEED, -MAX_SPEED, MAX_SPEED);
[1.378s] 5: @@ -46,17 +77,5 @@
[1.378s] 5: -    void joy_callback(const sensor_msgs::msg::Joy &msg)
[1.378s] 5: -    {
[1.378s] 5: -        // ボタンをチェックしてモードを切り替える
[1.378s] 5: -        if (msg.buttons.size() > 0)
[1.379s] 5: -        {
[1.379s] 5: -            // テスト
[1.379s] 5: -            if (msg.buttons[4] == 1)  // ボタン0が押された場合
[1.379s] 5: -            {
[1.379s] 5: -                mode_ = Mode::STOP;
[1.379s] 5: -                RCLCPP_INFO(this->get_logger(), "Mode switched to STOP");
[1.379s] 5: -            }
[1.379s] 5: -            else if (msg.buttons[6] == 1)  // ボタン1が押された場合
[1.380s] 5: -            {
[1.380s] 5: -                mode_ = Mode::DRIVE;
[1.380s] 5: -                RCLCPP_INFO(this->get_logger(), "Mode switched to DRIVE");
[1.380s] 5: -            }
[1.380s] 5: -        }
[1.380s] 5: +    auto message = custom_interfaces::msg::DriverVelocity();
[1.380s] 5: +    message.m1_vel = m1_vel;
[1.380s] 5: +    message.m2_vel = m2_vel;
[1.380s] 5: +    publisher_->publish(message);
[1.381s] 5: +  }
[1.381s] 5: @@ -64,13 +83,17 @@
[1.381s] 5: -        // モードがSTOPの場合は速度を0に設定
[1.381s] 5: -        if (mode_ == Mode::STOP)
[1.381s] 5: -        {
[1.381s] 5: -            m1_vel = 0.0f;
[1.381s] 5: -            m2_vel = 0.0f;
[1.381s] 5: -        }
[1.381s] 5: -        else if (mode_ == Mode::DRIVE)
[1.381s] 5: -        {
[1.381s] 5: -            if (msg.axes.size() < 4)
[1.381s] 5: -            {
[1.382s] 5: -                RCLCPP_WARN(this->get_logger(), "Joystick axes array is too small!");
[1.382s] 5: -                return;
[1.382s] 5: -            }
[1.382s] 5: +  void set_mode_callback(
[1.382s] 5: +    const std::shared_ptr<custom_interfaces::srv::SetMode::Request> request,
[1.382s] 5: +    std::shared_ptr<custom_interfaces::srv::SetMode::Response> response)
[1.382s] 5: +  {
[1.382s] 5: +    if (request->mode == "STOP") {
[1.382s] 5: +      mode_ = Mode::STOP;
[1.382s] 5: +      response->success = true;
[1.382s] 5: +      RCLCPP_INFO(this->get_logger(), "Mode set to STOP");
[1.382s] 5: +    } else if (request->mode == "DRIVE") {
[1.382s] 5: +      mode_ = Mode::DRIVE;
[1.382s] 5: +      response->success = true;
[1.383s] 5: +      RCLCPP_INFO(this->get_logger(), "Mode set to DRIVE");
[1.383s] 5: +    } else {
[1.383s] 5: +      response->success = false;
[1.383s] 5: +      RCLCPP_WARN(this->get_logger(), "Invalid mode requested");
[1.383s] 5: +    }
[1.383s] 5: +  }
[1.383s] 5: @@ -78,38 +101,3 @@
[1.383s] 5: -            float m1_axis_y = applyDeadzone(std::clamp<float>(msg.axes[1], -0.95f, 0.95f), DEADZONE);
[1.383s] 5: -            float m2_axis_y = applyDeadzone(std::clamp<float>(msg.axes[3], -0.95f, 0.95f), DEADZONE);
[1.383s] 5: -
[1.383s] 5: -            m1_vel = std::clamp<float>(m1_axis_y * MAX_SPEED, -MAX_SPEED, MAX_SPEED);
[1.383s] 5: -            m2_vel = std::clamp<float>(m2_axis_y * MAX_SPEED, -MAX_SPEED, MAX_SPEED);
[1.383s] 5: -        }
[1.383s] 5: -
[1.384s] 5: -        auto message = custom_interfaces::msg::DriverVelocity();
[1.384s] 5: -        message.m1_vel = m1_vel;
[1.384s] 5: -        message.m2_vel = m2_vel;
[1.384s] 5: -        publisher_->publish(message);
[1.384s] 5: -    }
[1.384s] 5: -
[1.384s] 5: -    void set_mode_callback(const std::shared_ptr<custom_interfaces::srv::SetMode::Request> request,
[1.384s] 5: -                           std::shared_ptr<custom_interfaces::srv::SetMode::Response> response)
[1.384s] 5: -    {
[1.384s] 5: -        if (request->mode == "STOP")
[1.384s] 5: -        {
[1.384s] 5: -            mode_ = Mode::STOP;
[1.384s] 5: -            response->success = true;
[1.384s] 5: -            RCLCPP_INFO(this->get_logger(), "Mode set to STOP");
[1.384s] 5: -        }
[1.384s] 5: -        else if (request->mode == "DRIVE")
[1.385s] 5: -        {
[1.385s] 5: -            mode_ = Mode::DRIVE;
[1.385s] 5: -            response->success = true;
[1.385s] 5: -            RCLCPP_INFO(this->get_logger(), "Mode set to DRIVE");
[1.385s] 5: -        }
[1.385s] 5: -        else
[1.385s] 5: -        {
[1.385s] 5: -            response->success = false;
[1.385s] 5: -            RCLCPP_WARN(this->get_logger(), "Invalid mode requested");
[1.385s] 5: -        }
[1.385s] 5: -    }
[1.385s] 5: -
[1.385s] 5: -    rclcpp::Subscription<sensor_msgs::msg::Joy>::SharedPtr subscription_;
[1.385s] 5: -    rclcpp::Publisher<custom_interfaces::msg::DriverVelocity>::SharedPtr publisher_;
[1.385s] 5: -    rclcpp::Service<custom_interfaces::srv::SetMode>::SharedPtr service_;
[1.386s] 5: +  rclcpp::Subscription<sensor_msgs::msg::Joy>::SharedPtr subscription_;
[1.386s] 5: +  rclcpp::Publisher<custom_interfaces::msg::DriverVelocity>::SharedPtr publisher_;
[1.386s] 5: +  rclcpp::Service<custom_interfaces::srv::SetMode>::SharedPtr service_;
[1.386s] 5: @@ -118 +106 @@
[1.386s] 5: -int main(int argc, char *argv[])
[1.386s] 5: +int main(int argc, char * argv[])
[1.386s] 5: @@ -120,4 +108,4 @@
[1.386s] 5: -    rclcpp::init(argc, argv);
[1.386s] 5: -    rclcpp::spin(std::make_shared<Operator>());
[1.386s] 5: -    rclcpp::shutdown();
[1.387s] 5: -    return 0;
[1.387s] 5: +  rclcpp::init(argc, argv);
[1.387s] 5: +  rclcpp::spin(std::make_shared<Operator>());
[1.387s] 5: +  rclcpp::shutdown();
[1.387s] 5: +  return 0;
[1.387s] 5: 
[1.387s] 5: 1 files with code style divergence
[1.387s] 5: -- run_test.py: return code 1
[1.387s] 5: -- run_test.py: verify result file '/root/working/rodep_ros2/yano_ws/build/operator/test_results/operator/uncrustify.xunit.xml'
[1.397s] 5/6 Test #5: uncrustify .......................***Failed    0.21 sec
[1.397s] test 6
[1.397s]     Start 6: xmllint
[1.398s] 
[1.398s] 6: Test command: /usr/bin/python3 "-u" "/opt/ros/humble/share/ament_cmake_test/cmake/run_test.py" "/root/working/rodep_ros2/yano_ws/build/operator/test_results/operator/xmllint.xunit.xml" "--package-name" "operator" "--output-file" "/root/working/rodep_ros2/yano_ws/build/operator/ament_xmllint/xmllint.txt" "--command" "/opt/ros/humble/bin/ament_xmllint" "--xunit-file" "/root/working/rodep_ros2/yano_ws/build/operator/test_results/operator/xmllint.xunit.xml"
[1.398s] 6: Test timeout computed to be: 60
[1.468s] 6: -- run_test.py: invoking following command in '/root/working/rodep_ros2/yano_ws/src/operator':
[1.469s] 6:  - /opt/ros/humble/bin/ament_xmllint --xunit-file /root/working/rodep_ros2/yano_ws/build/operator/test_results/operator/xmllint.xunit.xml
[1.899s] 6: File 'package.xml' is valid
[1.899s] 6: 
[1.899s] 6: No problems found
[1.912s] 6: -- run_test.py: return code 0
[1.912s] 6: -- run_test.py: verify result file '/root/working/rodep_ros2/yano_ws/build/operator/test_results/operator/xmllint.xunit.xml'
[1.922s] 6/6 Test #6: xmllint ..........................   Passed    0.52 sec
[1.922s] 
[1.923s] 50% tests passed[0;0m, [0;31m3 tests failed[0;0m out of 6
[1.923s] 
[1.923s] Label Time Summary:
[1.923s] cppcheck      =   0.24 sec*proc (1 test)
[1.923s] flake8        =   0.36 sec*proc (1 test)
[1.923s] lint_cmake    =   0.26 sec*proc (1 test)
[1.923s] linter        =   1.87 sec*proc (6 tests)
[1.924s] pep257        =   0.29 sec*proc (1 test)
[1.924s] uncrustify    =   0.21 sec*proc (1 test)
[1.924s] xmllint       =   0.52 sec*proc (1 test)
[1.924s] 
[1.924s] Total Test time (real) =   1.88 sec
[1.924s] 
[1.924s] The following tests FAILED:
[1.924s] 	[0;31m  2 - flake8 (Failed)[0;0m
[1.924s] 	[0;31m  3 - lint_cmake (Failed)[0;0m
[1.924s] 	[0;31m  5 - uncrustify (Failed)[0;0m
[1.926s] Errors while running CTest
[1.926s] Output from these tests are in: /root/working/rodep_ros2/yano_ws/build/operator/Testing/Temporary/LastTest.log
[1.926s] Use "--rerun-failed --output-on-failure" to re-run the failed cases verbosely.
[1.929s] Invoked command in '/root/working/rodep_ros2/yano_ws/build/operator' returned '8': AMENT_PREFIX_PATH=/root/working/rodep_ros2/yano_ws/install/operator:/root/working/rodep_ros2/yano_ws/install/custom_interfaces:${AMENT_PREFIX_PATH} CMAKE_PREFIX_PATH=/root/working/rodep_ros2/yano_ws/install/operator:/root/working/rodep_ros2/yano_ws/install/custom_interfaces LD_LIBRARY_PATH=/root/working/rodep_ros2/yano_ws/install/custom_interfaces/lib:${LD_LIBRARY_PATH} PYTHONPATH=/root/working/rodep_ros2/yano_ws/install/custom_interfaces/local/lib/python3.10/dist-packages:${PYTHONPATH} /usr/bin/ctest -C Release -D ExperimentalTest --no-compress-output -V --force-new-ctest-process
