[0.035s] Invoking command in '/root/working/rodep_ros2/yano_ws/build/operator': AMENT_PREFIX_PATH=/root/working/rodep_ros2/yano_ws/install/operator:/root/working/rodep_ros2/yano_ws/install/custom_interfaces:${AMENT_PREFIX_PATH} CMAKE_PREFIX_PATH=/root/working/rodep_ros2/yano_ws/install/operator:/root/working/rodep_ros2/yano_ws/install/custom_interfaces LD_LIBRARY_PATH=/root/working/rodep_ros2/yano_ws/install/custom_interfaces/lib:${LD_LIBRARY_PATH} PYTHONPATH=/root/working/rodep_ros2/yano_ws/install/custom_interfaces/local/lib/python3.10/dist-packages:${PYTHONPATH} /usr/bin/ctest -C Release -D ExperimentalTest --no-compress-output -V --force-new-ctest-process
[0.046s] UpdateCTestConfiguration  from :/root/working/rodep_ros2/yano_ws/build/operator/CTestConfiguration.ini
[0.046s] Parse Config file:/root/working/rodep_ros2/yano_ws/build/operator/CTestConfiguration.ini
[0.046s]    Site: cf33789d9224
[0.046s]    Build name: (empty)
[0.047s]  Add coverage exclude regular expressions.
[0.047s] Create new tag: 20250307-1047 - Experimental
[0.047s] UpdateCTestConfiguration  from :/root/working/rodep_ros2/yano_ws/build/operator/CTestConfiguration.ini
[0.047s] Parse Config file:/root/working/rodep_ros2/yano_ws/build/operator/CTestConfiguration.ini
[0.047s] Test project /root/working/rodep_ros2/yano_ws/build/operator
[0.048s] Constructing a list of tests
[0.048s] Done constructing a list of tests
[0.048s] Updating test list for fixtures
[0.048s] Added 0 tests to meet fixture requirements
[0.048s] Checking test dependency graph...
[0.048s] Checking test dependency graph end
[0.048s] test 1
[0.049s]     Start 1: cppcheck
[0.049s] 
[0.049s] 1: Test command: /usr/bin/python3 "-u" "/opt/ros/humble/share/ament_cmake_test/cmake/run_test.py" "/root/working/rodep_ros2/yano_ws/build/operator/test_results/operator/cppcheck.xunit.xml" "--package-name" "operator" "--output-file" "/root/working/rodep_ros2/yano_ws/build/operator/ament_cppcheck/cppcheck.txt" "--command" "/opt/ros/humble/bin/ament_cppcheck" "--xunit-file" "/root/working/rodep_ros2/yano_ws/build/operator/test_results/operator/cppcheck.xunit.xml"
[0.049s] 1: Test timeout computed to be: 300
[0.160s] 1: -- run_test.py: invoking following command in '/root/working/rodep_ros2/yano_ws/src/operator':
[0.160s] 1:  - /opt/ros/humble/bin/ament_cppcheck --xunit-file /root/working/rodep_ros2/yano_ws/build/operator/test_results/operator/cppcheck.xunit.xml
[0.276s] 1: cppcheck 2.7 has known performance issues and therefore will not be used, set the AMENT_CPPCHECK_ALLOW_SLOW_VERSIONS environment variable to override this.
[0.292s] 1: -- run_test.py: return code 0
[0.292s] 1: -- run_test.py: verify result file '/root/working/rodep_ros2/yano_ws/build/operator/test_results/operator/cppcheck.xunit.xml'
[0.305s] 1/6 Test #1: cppcheck .........................   Passed    0.26 sec
[0.305s] test 2
[0.305s]     Start 2: flake8
[0.305s] 
[0.305s] 2: Test command: /usr/bin/python3 "-u" "/opt/ros/humble/share/ament_cmake_test/cmake/run_test.py" "/root/working/rodep_ros2/yano_ws/build/operator/test_results/operator/flake8.xunit.xml" "--package-name" "operator" "--output-file" "/root/working/rodep_ros2/yano_ws/build/operator/ament_flake8/flake8.txt" "--command" "/opt/ros/humble/bin/ament_flake8" "--xunit-file" "/root/working/rodep_ros2/yano_ws/build/operator/test_results/operator/flake8.xunit.xml"
[0.306s] 2: Test timeout computed to be: 60
[0.380s] 2: -- run_test.py: invoking following command in '/root/working/rodep_ros2/yano_ws/src/operator':
[0.381s] 2:  - /opt/ros/humble/bin/ament_flake8 --xunit-file /root/working/rodep_ros2/yano_ws/build/operator/test_results/operator/flake8.xunit.xml
[0.661s] 2: def generate_launch_description():
[0.662s] 2: ^
[0.662s] 2: 	return LaunchDescription([
[0.662s] 2: ^
[0.662s] 2:         Node(
[0.662s] 2: ^
[0.662s] 2:         Node(
[0.662s] 2:         ^
[0.662s] 2:             package="joy",
[0.663s] 2: ^
[0.663s] 2:             # namespace="",
[0.663s] 2: ^
[0.663s] 2:             executable="joy_node",
[0.663s] 2: ^
[0.663s] 2:             name="pub_joy"
[0.663s] 2: ^
[0.663s] 2:         ),
[0.664s] 2: ^
[0.664s] 2: 		Node(
[0.664s] 2: ^
[0.664s] 2: 			package='operator',
[0.664s] 2: ^
[0.664s] 2: 			executable='operator_node',
[0.665s] 2: ^
[0.665s] 2: 			name='operator_node',
[0.665s] 2: ^
[0.665s] 2: 			output='screen',
[0.665s] 2: ^
[0.666s] 2: 		),
[0.666s] 2: ^
[0.666s] 2: 	])
[0.666s] 2: ^
[0.666s] 2: 6     E101 indentation contains mixed spaces and tabs
[0.666s] 2: 1     E122 continuation line missing indentation or outdented
[0.666s] 2: 1     E302 expected 2 blank lines, found 1
[0.666s] 2: 8     W191 indentation contains tabs
[0.666s] 2: 
[0.667s] 2: ./launch/operator_launch.py:4:1: E302 expected 2 blank lines, found 1
[0.667s] 2: 
[0.667s] 2: ./launch/operator_launch.py:5:1: W191 indentation contains tabs
[0.667s] 2: 
[0.667s] 2: ./launch/operator_launch.py:6:1: E101 indentation contains mixed spaces and tabs
[0.667s] 2: 
[0.667s] 2: ./launch/operator_launch.py:6:9: E122 continuation line missing indentation or outdented
[0.667s] 2: 
[0.668s] 2: ./launch/operator_launch.py:7:1: E101 indentation contains mixed spaces and tabs
[0.668s] 2: 
[0.668s] 2: ./launch/operator_launch.py:8:1: E101 indentation contains mixed spaces and tabs
[0.668s] 2: 
[0.668s] 2: ./launch/operator_launch.py:9:1: E101 indentation contains mixed spaces and tabs
[0.668s] 2: 
[0.668s] 2: ./launch/operator_launch.py:10:1: E101 indentation contains mixed spaces and tabs
[0.668s] 2: 
[0.668s] 2: ./launch/operator_launch.py:11:1: E101 indentation contains mixed spaces and tabs
[0.668s] 2: 
[0.669s] 2: ./launch/operator_launch.py:12:1: W191 indentation contains tabs
[0.669s] 2: 
[0.669s] 2: ./launch/operator_launch.py:13:1: W191 indentation contains tabs
[0.669s] 2: 
[0.669s] 2: ./launch/operator_launch.py:14:1: W191 indentation contains tabs
[0.669s] 2: 
[0.669s] 2: ./launch/operator_launch.py:15:1: W191 indentation contains tabs
[0.669s] 2: 
[0.669s] 2: ./launch/operator_launch.py:16:1: W191 indentation contains tabs
[0.670s] 2: 
[0.670s] 2: ./launch/operator_launch.py:17:1: W191 indentation contains tabs
[0.670s] 2: 
[0.670s] 2: ./launch/operator_launch.py:18:1: W191 indentation contains tabs
[0.670s] 2: 
[0.670s] 2: 
[0.670s] 2: 1 files checked
[0.670s] 2: 16 errors
[0.670s] 2: 
[0.671s] 2: 'E'-type errors: 8
[0.671s] 2: 'W'-type errors: 8
[0.671s] 2: 
[0.671s] 2: Checked files:
[0.671s] 2: 
[0.671s] 2: * ./launch/operator_launch.py
[0.686s] 2: -- run_test.py: return code 1
[0.687s] 2: -- run_test.py: verify result file '/root/working/rodep_ros2/yano_ws/build/operator/test_results/operator/flake8.xunit.xml'
[0.700s] 2/6 Test #2: flake8 ...........................***Failed    0.39 sec
[0.700s] test 3
[0.701s]     Start 3: lint_cmake
[0.701s] 
[0.701s] 3: Test command: /usr/bin/python3 "-u" "/opt/ros/humble/share/ament_cmake_test/cmake/run_test.py" "/root/working/rodep_ros2/yano_ws/build/operator/test_results/operator/lint_cmake.xunit.xml" "--package-name" "operator" "--output-file" "/root/working/rodep_ros2/yano_ws/build/operator/ament_lint_cmake/lint_cmake.txt" "--command" "/opt/ros/humble/bin/ament_lint_cmake" "--xunit-file" "/root/working/rodep_ros2/yano_ws/build/operator/test_results/operator/lint_cmake.xunit.xml"
[0.701s] 3: Test timeout computed to be: 60
[0.804s] 3: -- run_test.py: invoking following command in '/root/working/rodep_ros2/yano_ws/src/operator':
[0.804s] 3:  - /opt/ros/humble/bin/ament_lint_cmake --xunit-file /root/working/rodep_ros2/yano_ws/build/operator/test_results/operator/lint_cmake.xunit.xml
[0.924s] 3: CMakeLists.txt:23: Tab found; please use spaces [whitespace/tabs]
[0.924s] 3: CMakeLists.txt:24: Tab found; please use spaces [whitespace/tabs]
[0.924s] 3: CMakeLists.txt:24: Line ends in whitespace [whitespace/eol]
[0.924s] 3: 
[0.924s] 3: 
[0.924s] 3: 3 errors
[0.942s] 3: -- run_test.py: return code 1
[0.942s] 3: -- run_test.py: verify result file '/root/working/rodep_ros2/yano_ws/build/operator/test_results/operator/lint_cmake.xunit.xml'
[0.953s] 3/6 Test #3: lint_cmake .......................***Failed    0.25 sec
[0.953s] test 4
[0.954s]     Start 4: pep257
[0.954s] 
[0.954s] 4: Test command: /usr/bin/python3 "-u" "/opt/ros/humble/share/ament_cmake_test/cmake/run_test.py" "/root/working/rodep_ros2/yano_ws/build/operator/test_results/operator/pep257.xunit.xml" "--package-name" "operator" "--output-file" "/root/working/rodep_ros2/yano_ws/build/operator/ament_pep257/pep257.txt" "--command" "/opt/ros/humble/bin/ament_pep257" "--xunit-file" "/root/working/rodep_ros2/yano_ws/build/operator/test_results/operator/pep257.xunit.xml"
[0.954s] 4: Test timeout computed to be: 60
[1.028s] 4: -- run_test.py: invoking following command in '/root/working/rodep_ros2/yano_ws/src/operator':
[1.028s] 4:  - /opt/ros/humble/bin/ament_pep257 --xunit-file /root/working/rodep_ros2/yano_ws/build/operator/test_results/operator/pep257.xunit.xml
[1.194s] 4: checking ./launch/operator_launch.py
[1.194s] 4: No problems found
[1.220s] 4: -- run_test.py: return code 0
[1.220s] 4: -- run_test.py: verify result file '/root/working/rodep_ros2/yano_ws/build/operator/test_results/operator/pep257.xunit.xml'
[1.230s] 4/6 Test #4: pep257 ...........................   Passed    0.28 sec
[1.230s] test 5
[1.230s]     Start 5: uncrustify
[1.231s] 
[1.231s] 5: Test command: /usr/bin/python3 "-u" "/opt/ros/humble/share/ament_cmake_test/cmake/run_test.py" "/root/working/rodep_ros2/yano_ws/build/operator/test_results/operator/uncrustify.xunit.xml" "--package-name" "operator" "--output-file" "/root/working/rodep_ros2/yano_ws/build/operator/ament_uncrustify/uncrustify.txt" "--command" "/opt/ros/humble/bin/ament_uncrustify" "--xunit-file" "/root/working/rodep_ros2/yano_ws/build/operator/test_results/operator/uncrustify.xunit.xml"
[1.231s] 5: Test timeout computed to be: 60
[1.299s] 5: -- run_test.py: invoking following command in '/root/working/rodep_ros2/yano_ws/src/operator':
[1.300s] 5:  - /opt/ros/humble/bin/ament_uncrustify --xunit-file /root/working/rodep_ros2/yano_ws/build/operator/test_results/operator/uncrustify.xunit.xml
[1.412s] 5: Code style divergence in file 'src/operator.cpp':
[1.412s] 5: 
[1.412s] 5: --- src/operator.cpp
[1.412s] 5: +++ src/operator.cpp.uncrustify
[1.412s] 5: @@ -19 +19 @@
[1.413s] 5: -    enum class Mode { STOP, DRIVE };
[1.413s] 5: +  enum class Mode { STOP, DRIVE };
[1.414s] 5: @@ -21,5 +21,5 @@
[1.414s] 5: -    Operator()
[1.414s] 5: -        : Node("operator"), m1_vel(0.0f), m2_vel(0.0f), mode_(Mode::STOP)
[1.415s] 5: -    {
[1.415s] 5: -        subscription_ = this->create_subscription<sensor_msgs::msg::Joy>(
[1.415s] 5: -            "/joy", 10, std::bind(&Operator::joy_callback, this, _1));
[1.415s] 5: +  Operator()
[1.415s] 5: +  : Node("operator"), m1_vel(0.0f), m2_vel(0.0f), mode_(Mode::STOP)
[1.415s] 5: +  {
[1.416s] 5: +    subscription_ = this->create_subscription<sensor_msgs::msg::Joy>(
[1.417s] 5: +      "/joy", 10, std::bind(&Operator::joy_callback, this, _1));
[1.417s] 5: @@ -27,4 +27,31 @@
[1.417s] 5: -        publisher_ = this->create_publisher<custom_interfaces::msg::DriverVelocity>("/driver", 10);
[1.417s] 5: -        
[1.417s] 5: -        service_ = this->create_service<custom_interfaces::srv::SetMode>(
[1.417s] 5: -            "/set_mode", std::bind(&Operator::set_mode_callback, this, _1, _2));
[1.417s] 5: +    publisher_ = this->create_publisher<custom_interfaces::msg::DriverVelocity>("/driver", 10);
[1.417s] 5: +
[1.417s] 5: +    service_ = this->create_service<custom_interfaces::srv::SetMode>(
[1.417s] 5: +      "/set_mode", std::bind(&Operator::set_mode_callback, this, _1, _2));
[1.417s] 5: +  }
[1.418s] 5: +
[1.418s] 5: +private:
[1.418s] 5: +  static constexpr float WIDTH = 0.29f;
[1.418s] 5: +  static constexpr float MAX_SPEED = 0.5f;
[1.418s] 5: +  static constexpr float DEADZONE = 0.1f;
[1.418s] 5: +
[1.418s] 5: +  float m1_vel, m2_vel;
[1.418s] 5: +  Mode mode_;
[1.418s] 5: +
[1.418s] 5: +  static float applyDeadzone(float val, float threshold)
[1.418s] 5: +  {
[1.418s] 5: +    return (std::abs(val) < threshold) ? 0.0f : val;
[1.418s] 5: +  }
[1.418s] 5: +
[1.419s] 5: +  void joy_callback(const sensor_msgs::msg::Joy & msg)
[1.419s] 5: +  {
[1.419s] 5: +    // ボタンをチェックしてモードを切り替える
[1.419s] 5: +    if (msg.buttons.size() > 0) {
[1.419s] 5: +      // テスト
[1.419s] 5: +      if (msg.buttons[4] == 1) {      // ボタン0が押された場合
[1.419s] 5: +        mode_ = Mode::STOP;
[1.419s] 5: +        RCLCPP_INFO(this->get_logger(), "Mode switched to STOP");
[1.419s] 5: +      } else if (msg.buttons[6] == 1) {    // ボタン1が押された場合
[1.419s] 5: +        mode_ = Mode::DRIVE;
[1.419s] 5: +        RCLCPP_INFO(this->get_logger(), "Mode switched to DRIVE");
[1.419s] 5: +      }
[1.419s] 5: @@ -33,4 +60,9 @@
[1.419s] 5: -private:
[1.419s] 5: -    static constexpr float WIDTH = 0.29f;
[1.420s] 5: -    static constexpr float MAX_SPEED = 0.5f;
[1.420s] 5: -    static constexpr float DEADZONE = 0.1f;
[1.420s] 5: +    // モードがSTOPの場合は速度を0に設定
[1.420s] 5: +    if (mode_ == Mode::STOP) {
[1.420s] 5: +      m1_vel = 0.0f;
[1.420s] 5: +      m2_vel = 0.0f;
[1.420s] 5: +    } else if (mode_ == Mode::DRIVE) {
[1.420s] 5: +      if (msg.axes.size() < 4) {
[1.420s] 5: +        RCLCPP_WARN(this->get_logger(), "Joystick axes array is too small!");
[1.420s] 5: +        return;
[1.420s] 5: +      }
[1.420s] 5: @@ -38,2 +70,2 @@
[1.420s] 5: -    float m1_vel, m2_vel;
[1.420s] 5: -    Mode mode_;
[1.420s] 5: +      float m1_axis_y = applyDeadzone(std::clamp<float>(msg.axes[1], -0.95f, 0.95f), DEADZONE);
[1.420s] 5: +      float m2_axis_y = applyDeadzone(std::clamp<float>(msg.axes[3], -0.95f, 0.95f), DEADZONE);
[1.421s] 5: @@ -41,3 +73,2 @@
[1.421s] 5: -    static float applyDeadzone(float val, float threshold)
[1.421s] 5: -    {
[1.421s] 5: -        return (std::abs(val) < threshold) ? 0.0f : val;
[1.421s] 5: +      m1_vel = std::clamp<float>(m1_axis_y * MAX_SPEED, -MAX_SPEED, MAX_SPEED);
[1.421s] 5: +      m2_vel = std::clamp<float>(m2_axis_y * MAX_SPEED, -MAX_SPEED, MAX_SPEED);
[1.421s] 5: @@ -46,17 +77,5 @@
[1.421s] 5: -    void joy_callback(const sensor_msgs::msg::Joy &msg)
[1.421s] 5: -    {
[1.421s] 5: -        // ボタンをチェックしてモードを切り替える
[1.421s] 5: -        if (msg.buttons.size() > 0)
[1.421s] 5: -        {
[1.421s] 5: -            // テスト
[1.421s] 5: -            if (msg.buttons[4] == 1)  // ボタン0が押された場合
[1.422s] 5: -            {
[1.422s] 5: -                mode_ = Mode::STOP;
[1.422s] 5: -                RCLCPP_INFO(this->get_logger(), "Mode switched to STOP");
[1.422s] 5: -            }
[1.422s] 5: -            else if (msg.buttons[6] == 1)  // ボタン1が押された場合
[1.422s] 5: -            {
[1.422s] 5: -                mode_ = Mode::DRIVE;
[1.422s] 5: -                RCLCPP_INFO(this->get_logger(), "Mode switched to DRIVE");
[1.422s] 5: -            }
[1.422s] 5: -        }
[1.422s] 5: +    auto message = custom_interfaces::msg::DriverVelocity();
[1.422s] 5: +    message.m1_vel = m1_vel;
[1.422s] 5: +    message.m2_vel = m2_vel;
[1.422s] 5: +    publisher_->publish(message);
[1.422s] 5: +  }
[1.423s] 5: @@ -64,13 +83,17 @@
[1.423s] 5: -        // モードがSTOPの場合は速度を0に設定
[1.423s] 5: -        if (mode_ == Mode::STOP)
[1.423s] 5: -        {
[1.423s] 5: -            m1_vel = 0.0f;
[1.423s] 5: -            m2_vel = 0.0f;
[1.423s] 5: -        }
[1.423s] 5: -        else if (mode_ == Mode::DRIVE)
[1.423s] 5: -        {
[1.423s] 5: -            if (msg.axes.size() < 4)
[1.423s] 5: -            {
[1.423s] 5: -                RCLCPP_WARN(this->get_logger(), "Joystick axes array is too small!");
[1.423s] 5: -                return;
[1.423s] 5: -            }
[1.423s] 5: +  void set_mode_callback(
[1.424s] 5: +    const std::shared_ptr<custom_interfaces::srv::SetMode::Request> request,
[1.424s] 5: +    std::shared_ptr<custom_interfaces::srv::SetMode::Response> response)
[1.424s] 5: +  {
[1.424s] 5: +    if (request->mode == "STOP") {
[1.424s] 5: +      mode_ = Mode::STOP;
[1.424s] 5: +      response->success = true;
[1.424s] 5: +      RCLCPP_INFO(this->get_logger(), "Mode set to STOP");
[1.424s] 5: +    } else if (request->mode == "DRIVE") {
[1.424s] 5: +      mode_ = Mode::DRIVE;
[1.424s] 5: +      response->success = true;
[1.424s] 5: +      RCLCPP_INFO(this->get_logger(), "Mode set to DRIVE");
[1.424s] 5: +    } else {
[1.424s] 5: +      response->success = false;
[1.424s] 5: +      RCLCPP_WARN(this->get_logger(), "Invalid mode requested");
[1.425s] 5: +    }
[1.425s] 5: +  }
[1.425s] 5: @@ -78,38 +101,3 @@
[1.425s] 5: -            float m1_axis_y = applyDeadzone(std::clamp<float>(msg.axes[1], -0.95f, 0.95f), DEADZONE);
[1.425s] 5: -            float m2_axis_y = applyDeadzone(std::clamp<float>(msg.axes[3], -0.95f, 0.95f), DEADZONE);
[1.425s] 5: -
[1.425s] 5: -            m1_vel = std::clamp<float>(m1_axis_y * MAX_SPEED, -MAX_SPEED, MAX_SPEED);
[1.425s] 5: -            m2_vel = std::clamp<float>(m2_axis_y * MAX_SPEED, -MAX_SPEED, MAX_SPEED);
[1.425s] 5: -        }
[1.425s] 5: -
[1.425s] 5: -        auto message = custom_interfaces::msg::DriverVelocity();
[1.425s] 5: -        message.m1_vel = m1_vel;
[1.425s] 5: -        message.m2_vel = m2_vel;
[1.425s] 5: -        publisher_->publish(message);
[1.425s] 5: -    }
[1.426s] 5: -
[1.426s] 5: -    void set_mode_callback(const std::shared_ptr<custom_interfaces::srv::SetMode::Request> request,
[1.426s] 5: -                           std::shared_ptr<custom_interfaces::srv::SetMode::Response> response)
[1.426s] 5: -    {
[1.426s] 5: -        if (request->mode == "STOP")
[1.426s] 5: -        {
[1.426s] 5: -            mode_ = Mode::STOP;
[1.426s] 5: -            response->success = true;
[1.426s] 5: -            RCLCPP_INFO(this->get_logger(), "Mode set to STOP");
[1.426s] 5: -        }
[1.426s] 5: -        else if (request->mode == "DRIVE")
[1.426s] 5: -        {
[1.426s] 5: -            mode_ = Mode::DRIVE;
[1.426s] 5: -            response->success = true;
[1.426s] 5: -            RCLCPP_INFO(this->get_logger(), "Mode set to DRIVE");
[1.426s] 5: -        }
[1.426s] 5: -        else
[1.427s] 5: -        {
[1.427s] 5: -            response->success = false;
[1.427s] 5: -            RCLCPP_WARN(this->get_logger(), "Invalid mode requested");
[1.427s] 5: -        }
[1.427s] 5: -    }
[1.427s] 5: -
[1.427s] 5: -    rclcpp::Subscription<sensor_msgs::msg::Joy>::SharedPtr subscription_;
[1.427s] 5: -    rclcpp::Publisher<custom_interfaces::msg::DriverVelocity>::SharedPtr publisher_;
[1.427s] 5: -    rclcpp::Service<custom_interfaces::srv::SetMode>::SharedPtr service_;
[1.427s] 5: +  rclcpp::Subscription<sensor_msgs::msg::Joy>::SharedPtr subscription_;
[1.427s] 5: +  rclcpp::Publisher<custom_interfaces::msg::DriverVelocity>::SharedPtr publisher_;
[1.427s] 5: +  rclcpp::Service<custom_interfaces::srv::SetMode>::SharedPtr service_;
[1.427s] 5: @@ -118 +106 @@
[1.427s] 5: -int main(int argc, char *argv[])
[1.427s] 5: +int main(int argc, char * argv[])
[1.428s] 5: @@ -120,4 +108,4 @@
[1.428s] 5: -    rclcpp::init(argc, argv);
[1.428s] 5: -    rclcpp::spin(std::make_shared<Operator>());
[1.428s] 5: -    rclcpp::shutdown();
[1.428s] 5: -    return 0;
[1.428s] 5: +  rclcpp::init(argc, argv);
[1.428s] 5: +  rclcpp::spin(std::make_shared<Operator>());
[1.428s] 5: +  rclcpp::shutdown();
[1.429s] 5: +  return 0;
[1.429s] 5: 
[1.429s] 5: 1 files with code style divergence
[1.429s] 5: -- run_test.py: return code 1
[1.429s] 5: -- run_test.py: verify result file '/root/working/rodep_ros2/yano_ws/build/operator/test_results/operator/uncrustify.xunit.xml'
[1.439s] 5/6 Test #5: uncrustify .......................***Failed    0.21 sec
[1.439s] test 6
[1.439s]     Start 6: xmllint
[1.440s] 
[1.440s] 6: Test command: /usr/bin/python3 "-u" "/opt/ros/humble/share/ament_cmake_test/cmake/run_test.py" "/root/working/rodep_ros2/yano_ws/build/operator/test_results/operator/xmllint.xunit.xml" "--package-name" "operator" "--output-file" "/root/working/rodep_ros2/yano_ws/build/operator/ament_xmllint/xmllint.txt" "--command" "/opt/ros/humble/bin/ament_xmllint" "--xunit-file" "/root/working/rodep_ros2/yano_ws/build/operator/test_results/operator/xmllint.xunit.xml"
[1.440s] 6: Test timeout computed to be: 60
[1.522s] 6: -- run_test.py: invoking following command in '/root/working/rodep_ros2/yano_ws/src/operator':
[1.522s] 6:  - /opt/ros/humble/bin/ament_xmllint --xunit-file /root/working/rodep_ros2/yano_ws/build/operator/test_results/operator/xmllint.xunit.xml
[2.206s] 6: File 'package.xml' is valid
[2.206s] 6: 
[2.206s] 6: No problems found
[2.224s] 6: -- run_test.py: return code 0
[2.224s] 6: -- run_test.py: verify result file '/root/working/rodep_ros2/yano_ws/build/operator/test_results/operator/xmllint.xunit.xml'
[2.235s] 6/6 Test #6: xmllint ..........................   Passed    0.80 sec
[2.235s] 
[2.235s] 50% tests passed[0;0m, [0;31m3 tests failed[0;0m out of 6
[2.235s] 
[2.235s] Label Time Summary:
[2.236s] cppcheck      =   0.26 sec*proc (1 test)
[2.236s] flake8        =   0.39 sec*proc (1 test)
[2.236s] lint_cmake    =   0.25 sec*proc (1 test)
[2.236s] linter        =   2.18 sec*proc (6 tests)
[2.236s] pep257        =   0.28 sec*proc (1 test)
[2.236s] uncrustify    =   0.21 sec*proc (1 test)
[2.236s] xmllint       =   0.80 sec*proc (1 test)
[2.236s] 
[2.236s] Total Test time (real) =   2.19 sec
[2.236s] 
[2.236s] The following tests FAILED:
[2.236s] 	[0;31m  2 - flake8 (Failed)[0;0m
[2.237s] 	[0;31m  3 - lint_cmake (Failed)[0;0m
[2.237s] 	[0;31m  5 - uncrustify (Failed)[0;0m
[2.239s] Errors while running CTest
[2.239s] Output from these tests are in: /root/working/rodep_ros2/yano_ws/build/operator/Testing/Temporary/LastTest.log
[2.239s] Use "--rerun-failed --output-on-failure" to re-run the failed cases verbosely.
[2.241s] Invoked command in '/root/working/rodep_ros2/yano_ws/build/operator' returned '8': AMENT_PREFIX_PATH=/root/working/rodep_ros2/yano_ws/install/operator:/root/working/rodep_ros2/yano_ws/install/custom_interfaces:${AMENT_PREFIX_PATH} CMAKE_PREFIX_PATH=/root/working/rodep_ros2/yano_ws/install/operator:/root/working/rodep_ros2/yano_ws/install/custom_interfaces LD_LIBRARY_PATH=/root/working/rodep_ros2/yano_ws/install/custom_interfaces/lib:${LD_LIBRARY_PATH} PYTHONPATH=/root/working/rodep_ros2/yano_ws/install/custom_interfaces/local/lib/python3.10/dist-packages:${PYTHONPATH} /usr/bin/ctest -C Release -D ExperimentalTest --no-compress-output -V --force-new-ctest-process
